<?xml version="1.0" encoding="UTF-8"?>
<pages lib_version="3" design="pure" xmlns:xsi="http://www.w3.org/2001/XMLSchema-instance" xsi:noNamespaceSchemaLocation="../visu_config.xsd">
  <meta>
    <plugins>
      <plugin name="colorchooser"/>
      <plugin name="diagram"/>
      <plugin name="upnpcontroller"/>
    </plugins>
    <mappings>
      <mapping name="Close_Open">
        <entry value="0">zu</entry>
        <entry value="1">offen</entry>
      </mapping>
      <mapping name="Open_Close">
        <entry value="0">offen</entry>
        <entry value="1">zu</entry>
      </mapping>
      <mapping name="Off_On">
        <entry value="0">Aus</entry>
        <entry value="1">An</entry>
      </mapping>
      <mapping name="On_Off">
        <entry value="0">An</entry>
        <entry value="1">Aus</entry>
      </mapping>
      <mapping name="KonnexHVAC">
        <entry value="auto">Auto</entry>
        <entry value="comfort">Komfort</entry>
        <entry value="standby">Stand By</entry>
        <entry value="economy">Economy</entry>
        <entry value="building_protection">Haus-Schutz</entry>
      </mapping>
    </mappings>
    <stylings>
      <styling name="Red_Green">
        <entry value="0">red</entry>
        <entry value="1">green</entry>
      </styling>
      <styling name="Green_Red">
        <entry value="0">green</entry>
        <entry value="1">red</entry>
      </styling>
      <styling name="Blue_Green_Red">
        <entry range_min="-100" range_max="20">blue</entry>
        <entry range_min="20" range_max="22">green</entry>
        <entry range_min="22" range_max="100">red</entry>
      </styling>
    </stylings>
    <statusbar>
      <status type="html">&lt;img src="icon/comet_64_ff8000.png" alt="CometVisu" /&gt; by &lt;a href="http://www.cometvisu.org/"&gt;CometVisu.org&lt;/a&gt;
        - &lt;a href=".?forceReload=true"&gt;Reload&lt;/a&gt;</status>
      <status type="html" condition="!edit" hrefextend="config"> - &lt;a href="editor/"&gt;Edit&lt;/a&gt;</status>
      <status type="html" condition="edit" hrefextend="config"> - &lt;a href="."&gt;normal Mode&lt;/a&gt;</status>
      <status type="html"> - &lt;a href="?config=demo"&gt;Widget Demo&lt;/a&gt;</status>
      <status type="html" hrefextend="config"> - &lt;a href="check_config.php"&gt;Check Config&lt;/a&gt;</status>
    </statusbar>
  </meta>
  <page name="Start">
    <line/>
    <text align="center">
      <label>Welcome to the CometVisu!</label>
    </text>
    <line/>
  </page>
</pages>
