<?xml version="1.0" encoding="UTF-8"?>
<pages xmlns:xsi="http://www.w3.org/2001/XMLSchema-instance" lib_version="8" design="pure" xsi:noNamespaceSchemaLocation="../visu_config.xsd">
  <meta>
    <plugins>
      <plugin name="colorchooser"/>
      <plugin name="diagram"/>
      <plugin name="upnpcontroller"/>
    </plugins>
    <mappings>
      <mapping name="Close_Open">
        <entry value="0">zu</entry>
        <entry value="1">offen</entry>
      </mapping>
      <mapping name="Open_Close">
        <entry value="0">offen</entry>
        <entry value="1">zu</entry>
      </mapping>
      <mapping name="Off_On">
        <entry value="0">Aus</entry>
        <entry value="1">An</entry>
      </mapping>
      <mapping name="On_Off">
        <entry value="0">An</entry>
        <entry value="1">Aus</entry>
      </mapping>
      <mapping name="KonnexHVAC">
        <entry value="auto">Auto</entry>
        <entry value="comfort">Komfort</entry>
        <entry value="standby">Stand By</entry>
        <entry value="economy">Economy</entry>
        <entry value="building_protection">Haus-Schutz</entry>
      </mapping>
    </mappings>
    <stylings>
      <styling name="Red_Green">
        <entry value="0">red</entry>
        <entry value="1">green</entry>
      </styling>
      <styling name="Green_Red">
        <entry value="0">green</entry>
        <entry value="1">red</entry>
      </styling>
      <styling name="Blue_Green_Red">
        <entry range_min="-100" range_max="20">blue</entry>
        <entry range_min="20" range_max="22">green</entry>
        <entry range_min="22" range_max="100">red</entry>
      </styling>
    </stylings>
    <statusbar>
      <status type="html"><![CDATA[
          <img src="icon/comet_64_ff8000.png" alt="CometVisu" /> by <a href="http://www.cometvisu.org/">CometVisu.org</a>
          - <a href=".?forceReload=true">Reload</a>
        ]]></status>
      <status type="html" condition="!edit" hrefextend="config"><![CDATA[
          - <a href="editor/">Edit</a>
        ]]></status>
      <status type="html" condition="edit" hrefextend="config"><![CDATA[
          - <a href=".">normal Mode</a>
        ]]></status>
      <status type="html"><![CDATA[
          - <a href="?config=demo">Widget Demo</a>
        ]]></status>
      <status type="html" hrefextend="config"><![CDATA[
          - <a href="check_config.php">Check Config</a>
        ]]></status>
    </statusbar>
  </meta>
  <page name="Start">
    <line>
      <layout colspan="12"/>
    </line>
    <text align="center">
      <label>Welcome to the CometVisu!</label>
    </text>
    <line>
      <layout colspan="12"/>
    </line>
  </page>
</pages>
